<?xml version="1.0" encoding="UTF-8" standalone="no" ?><!DOCTYPE dataset SYSTEM "binning.dtd"><?xml-stylesheet type="text/xsl" href="binning.xsl"?><binning>
        <!-- eta jet -->
        <bin id="1" type="inlcusive">
                <subbin>
                        <variable>etajet</variable>
                        <low_edge>0</low_edge>
                        <up_edge>1</up_edge>
                </subbin>
                <k_uds>0.918207</k_uds>
                <k_c>1.23014</k_c>
                <k_b>1.45179</k_b>
                <k_uds_err>0.00468141</k_uds_err>
                <k_c_err>0.01933</k_c_err>
                <k_b_err>0.0532972</k_b_err>
                <sigma_uds_true>0</sigma_uds_true>
                <sigma_c_true>14015.3</sigma_c_true>
                <sigma_b_true>676.917</sigma_b_true>
                <sigma_uds>0</sigma_uds>
                <sigma_c>17240.7</sigma_c>
                <sigma_b>982.738</sigma_b>
                <sigma_uds_err>0</sigma_uds_err>
                <sigma_c_err>270.915</sigma_c_err>
                <sigma_b_err>36.0778</sigma_b_err>
        </bin>
</binning>